Command: UPDATE Student SET total=mark1+mark2+mark3,average=(mark1+mark2+mark3)/3;

mysql> SELECT * from Student;
+-----------+------+--------+-------+-------+-------+-------+---------+---------+
| rollno    | name | gender | mark1 | mark2 | mark3 | total | average | dept_id |
+-----------+------+--------+-------+-------+-------+-------+---------+---------+
| 106120054 | John | M      |    70 |    70 |    60 |  NULL |    NULL |       1 |
| 106120074 | Ann  | F      |    80 |    70 |    90 |  NULL |    NULL |       3 |
| 106120089 | Melo | M      |    60 |    40 |    30 |  NULL |    NULL |       4 |
| 106120095 | Aap  | M      |    90 |    90 |   100 |  NULL |    NULL |       2 |
| 106120001 | Meno | F      |    20 |    30 |    50 |  NULL |    NULL |       3 |
| 106120005 | Acks | M      |    40 |    40 |    60 |  NULL |    NULL |       4 |
| 106120007 | Bob  | F      |    70 |    60 |    50 |  NULL |    NULL |       1 |
| 106120009 | Loko | M      |   100 |    90 |   100 |  NULL |    NULL |       1 |
| 106120011 | Skan | M      |   100 |   100 |   100 |  NULL |    NULL |       2 |
| 106120015 | Don  | M      |    99 |    99 |   100 |  NULL |    NULL |       1 |
+-----------+------+--------+-------+-------+-------+-------+---------+---------+
10 rows in set (0.00 sec)

mysql> UPDATE Student SET total=mark1+mark2+mark3,average=(mark1+mark2+mark3)/3;
Query OK, 10 rows affected (0.11 sec)
Rows matched: 10  Changed: 10  Warnings: 0

mysql> SELECT * from Student;
+-----------+------+--------+-------+-------+-------+-------+--------------+---------+
| rollno    | name | gender | mark1 | mark2 | mark3 | total | average      | dept_id |
+-----------+------+--------+-------+-------+-------+-------+--------------+---------+
| 106120054 | John | M      |    70 |    70 |    60 |   200 | 66.666666666 |       1 |
| 106120074 | Ann  | F      |    80 |    70 |    90 |   240 |           80 |       3 |
| 106120089 | Melo | M      |    60 |    40 |    30 |   130 | 43.333333333 |       4 |
| 106120095 | Aap  | M      |    90 |    90 |   100 |   280 | 93.333333333 |       2 |
| 106120001 | Meno | F      |    20 |    30 |    50 |   100 | 33.333333333 |       3 |
| 106120005 | Acks | M      |    40 |    40 |    60 |   140 | 46.666666666 |       4 |
| 106120007 | Bob  | F      |    70 |    60 |    50 |   180 |           60 |       1 |
| 106120009 | Loko | M      |   100 |    90 |   100 |   290 | 96.666666666 |       1 |
| 106120011 | Skan | M      |   100 |   100 |   100 |   300 |          100 |       2 |
| 106120015 | Don  | M      |    99 |    99 |   100 |   298 | 99.333333333 |       1 |
+-----------+------+--------+-------+-------+-------+-------+--------------+---------+
10 rows in set (0.00 sec)

